post_id,comment_id,title,body,subreddit,upvotes,comments,date_time,author
1ffhd75,,Best way to use o1 to review complex assignments? ,"How do you think it fairs with reviewing complex assignments? 

I have created a thematic analysis from 40 short survey responses. I’m writing a thesis on this, I’ve finished much of it, wondering if o1 would be good at looking at my current draft of the thematic analysis, looking at the raw response file and seeing if I’ve captured the data well in My phrasing of the results, or can suggest ways to rephrase any of my themes to better capture what the data communicates.

Also wondering how good it would be at looking at lecture notes for a research methods course and seeing if there’s much error in my reasoning for the corresponding assignment.

I’m basically asking if you guys think it would give better responses if I gave it ALL the information then asked a question, or if I broke the problem down into pieces and do it that way.. ",OpenAI,3,1,2024-09-13 00:08:33,Tonguebuster
1fjg9sh,,It’s great time to be alive but also really scary ,"
I’m a bit pumped up and need to vent a bit. I was procrastinating in the morning and decided to challenge myself to build an app using Claude and o1 within a day and just hit release to App Store after 6 hours of work. 

It’s a typical habit tracking app where you cannot add habits, with notifications set up and CoreData storage. I was not using any templates or libraries. Everything from scratch. 

I’m not waiting for App Store review. It’s crazy and a bit scary where this all goes.

It took only 6 hours, Carl! And I did not write a single line of code myself. 

My approach was the following: o1 was used for planning our architecture and data structure. Claude was better at writing actual code.

It’s crazy how fast this all goes. I don’t know if you will share my excitement but I feel like that with every other release of an advanced model: excitement and scary realization that I need to adopt (or call it “align”…) faster otherwise I can be obsolete.


P.S. I’m gonna continue playing with the app for tomorrow and planning to publish code on GitHub in a bit if someone interested.",OpenAI,276,73,2024-09-18 00:52:42,Ok_Maize_3709
1hl71or,,I asked o1 pro to write an essay about self control and how to focus your mind… it did not dissapoint,"Below is an in‑depth, essay‑style exploration of mental self-control techniques, structured thinking, and the building of a robust internal framework for motivation, focus, and “unreal” levels of mind‑body mastery. The central theme is that by diligently applying these principles, you can systematically build a mental fortress—keeping it organized, refining it over time, and experiencing greater autonomy over your actions and life trajectory.

I. Introduction: Why Structure Matters

For millennia, philosophers, mystics, and psychologists have toyed with variations of the same fundamental question: How can I harness the power of my mind? In essence, mental self-control means becoming the prime architect of your own thoughts, emotions, and behaviors. A strong mental framework provides a stable foundation; a weaker one collapses at the slightest stress.

Building “absolute” (or near-absolute) control over your mind might sound grandiose, but there are many systematic techniques you can adopt to cultivate extraordinary self‑awareness, discipline, and focus. The process is methodical, like constructing a skyscraper from bedrock to top floor—each layer depends on the integrity of the layer beneath it.

II. Foundational Principles of Mental Architecture

1. The Principle of Meta-Awareness

Meta-Awareness means observing your thoughts and mental processes while they happen. Instead of being swept up by an emotion or impulse, you develop a “bird’s-eye view” on your mind. This vantage point allows you to choose your reaction rather than habitually obeying the mental chatter.
	•	Technique: Daily “Check-In” Intervals
Set a timer or phone reminder every few hours. When it buzzes, pause for 30 seconds, note what you’re thinking and feeling, and label it. For instance: “I’m noticing anxiety about my deadline,” or “I’m daydreaming about lunch.” This labeling practice rewires your brain to see thoughts from a distance.

2. The Principle of Progression

Attempting “absolute control” in one shot often leads to frustration. Instead, approach self‑control as a series of incremental steps. You master a small skill (like resisting the urge to mindlessly scroll your phone), then you expand outward to bigger goals.
	•	Technique: Micro-Commitments
Promise yourself you’ll do something small (e.g., “Finish this paragraph before I check any messages”). Once you succeed, raise the bar modestly. Over time, these micro-commitments accumulate into formidable discipline.

3. The Principle of Holistic Balance

Pure “force of will” is rarely sustainable if your overall life—nutrition, sleep, social support—crashes. A sturdy mental architecture integrates both body and environment. Well-rested, well-fed, and physically active minds can handle more demanding self-control tasks.
	•	Technique: Foundational Habits
Build a daily baseline:
	1.	Nutrition: Balanced diet with minimal processed sugars.
	2.	Exercise: Regular physical activity to sharpen focus and blow off stress.
	3.	Sleep: 7–8 hours, non-negotiable for cognitive optimization.

III. Mental Framework Construction: Laying the Bricks

1. Goal Hierarchies (Mental “Blueprints”)

One key to unwavering self-discipline is having clear, hierarchical goals. Think of these as the architectural “blueprints” guiding your mental framework.
	1.	Long-Term Vision: The ultimate outcome (e.g., “Become a leading researcher in my field,” or “Achieve personal freedom through financial independence”).
	2.	Mid-Term Milestones: The floors of your mental skyscraper—significant achievements you aim for in 1–3 years (e.g., “Complete a Master’s Degree,” “Start a profitable online venture”).
	3.	Short-Term Objectives: Daily or weekly tasks that align with the upper-level goals.

	•	Technique: Reverse Engineering
Start with your long-term vision and break it into mid-term milestones, then break those into weekly or daily tasks. This ensures every daily action is connected to your bigger aspiration, boosting motivation and clarity.

2. Chunking and Layering Information

Humans are prone to overwhelm when faced with too much data. Chunking (grouping information into manageable segments) allows you to systematically handle complexity.
	•	Technique: Mind Mapping
Write or digitally map complex tasks into clusters (e.g., for launching a product: “Research,” “Development,” “Marketing,” “Operations”). Link sub-tasks under each cluster. This visually clarifies the structure, letting your mind step through tasks in an organized fashion.

3. Mental Tagging and Retrieval

A structured mind is one that can quickly retrieve relevant information or mental states. Think of mental tagging as building a “library index” in your head.
	•	Technique: Keyword Associations
Whenever you learn a new concept or strategy, label it with a memorable keyword (or short phrase). During reflection or problem-solving, recall that keyword. Over time, you build an internal “filing system,” letting you cross-reference ideas with minimal confusion.

IV. Strengthening the Structure: Maintaining Motivation and Focus

1. Motivation as a Dynamic Resource

Motivation isn’t a static trait—it’s more like a fluctuating “internal currency.” The key is to regularly replenish it through targeted behaviors:
	•	Technique: Reward Substitution
Instead of waiting for large, far-off rewards (e.g., finishing a 2-year project), create mini “celebrations” for each completed phase. This could be a short break, a piece of music you love, or a pat on the back from a friend. Tiny hits of positive reinforcement keep you going.

2. The Power of Visual and Emotional Cues

A significant aspect of self-control is forging an emotional resonance with your tasks. Pure rational willpower might wane if tasks feel lifeless or alien. By tying emotion to your goals, you fortify your mental architecture against distraction.
	•	Technique: Vision Boards and Trigger Objects
Keep tangible symbols of your aspirations in your workspace: a photo, an inspirational quote, a physical object. Each time you see it, let yourself feel the emotion behind your goal. This becomes a powerful anchor, reaffirming your direction.

3. Unshakable Focus: Getting to “Flow”

Flow is the state of being fully immersed in a task. It often arises when there’s an optimal balance between skill and challenge. Too easy? Boredom. Too hard? Anxiety. Just right? Deep focus.
	•	Technique: Time‑Boxing + Deep Work
	•	Time‑Boxing: Allocate a fixed duration (e.g., 90 minutes) to focus solely on one task, with no distractions allowed.
	•	Recovery Break: Follow that up with a short break (5–10 minutes) to recharge.
	•	Over repeated cycles, you train your brain to expect intense focus intervals and restful breaks—maximizing flow.

V. Achieving “Absolute” Mind Control: Tactics and Mindsets

“Absolute unreal control” may sound fanciful, yet many advanced practitioners—from elite athletes to Zen monks—show us glimpses of near‑perfect discipline. The following tactics aim to approach that level:

1. Single-Pointed Concentration Practices

Meditation traditions worldwide emphasize single-pointed concentration: focusing intently on a single object, sensation, or concept without letting the mind wander. Over time, this deeply rewires neural pathways for sustained attention.
	•	Technique: Breath Focus (Basic)
Sit comfortably, close your eyes, and home in on your breath. Each inhale and exhale is your universe. If your mind drifts, gently refocus on breathing. With regular practice (10–20 minutes a day), you can sustain concentration for longer periods.

2. Active Mind Control: Self-Talk and NLP

Neuro-Linguistic Programming (NLP) and strategic self‑talk can anchor your mind in productive states. This is more directed than passive mindfulness; it’s about giving yourself precise, empowering language.
	•	Technique: Positive Reframing
When you detect negative or unproductive thoughts (“I’m never going to finish this project”), immediately reframe: “I can break this into smaller tasks and finish on time.” Over months of consistent re-framing, your default mental patterns shift toward solution-focused positivity.

3. “Pre-Commitment” and Environment Control

Absolute self-control often requires controlling the environment that feeds your impulses. Humans are deeply influenced by cues, triggers, and contexts.
	•	Technique: Temptation Bundling / Environment Hacking
	•	Remove easy access to distractions (use website blockers, keep your phone in another room).
	•	Pair tasks with complementary triggers (e.g., only drink your favorite flavored tea while doing a difficult task). The pleasurable element helps mitigate mental resistance.

VI. Sustaining the Structure Long-Term

1. Iteration and Self-Audit

Even the strongest mental frameworks require regular assessment and recalibration. Life events—injuries, relationship changes, career shifts—can disrupt your carefully built routines.
	•	Technique: Monthly Mental Review
Ask yourself: “Which goals did I meet? Where did I fall short? Which habits are working? What do I need to adjust?” This simple reflection session helps you realign your blueprint.

2. Adapting to New Challenges

One hallmark of genius-level discipline is adaptability. As your tasks evolve in complexity, your mind’s structure should evolve too.
	•	Technique: Layering Complexity
If you move from “finishing a college assignment” to “launching a startup,” your mental frameworks must accommodate bigger tasks, more stakeholders, and higher stakes. Periodically up-level your strategies. For instance, shift from micro-commitments to full-blown project management systems like Scrum or Kanban.

3. Lifelong Learning Mindset

A mind that’s “done” growing is at risk of stagnation. Absolute control is a process, not an endpoint—it demands ongoing learning, skill acquisition, and curiosity. As you learn new psychological tools (biofeedback, advanced habit systems, journaling techniques), fold them into your existing structure.

VII. Potential Pitfalls and Realistic Boundaries
	1.	Perfectionism Trap
Striving for flawless self-control can lead to paralyzing perfectionism. True mastery includes the flexibility to err, adapt, and move forward without self-criticism.
	2.	Burnout
A single-minded pursuit of discipline without rest or play is a recipe for mental collapse. Paradoxically, planned leisure is essential to maintaining peak focus.
	3.	Social and Emotional Context
Humans are social creatures. Family obligations, friendships, and broader societal influences can tug at your mental structure. Cultivating open communication with loved ones and setting boundaries can protect your mental projects.

VIII. Conclusion: A Blueprint for Mind‑Body Mastery

Attaining extraordinary mental self-control—enough to direct your body, your work, and your entire life path with precision—demands methodical, layered practices. From the foundational principles of meta-awareness and incremental progress, to advanced single-pointed focus and environment design, you’re effectively crafting a mental ecosystem that fosters discipline and creative power.
	•	Lay the Foundation with stable routines (sleep, nutrition, exercise) to support high-level brain function.
	•	Build the Framework of clear goals and a structured, chunked approach to tasks.
	•	Strengthen the Walls of motivation and focus with emotional cues, flow strategies, and consistent feedback loops.
	•	Aim for the Pinnacle through higher-level concentration, positive reframing, and environment hacking.
	•	Sustain and Evolve by regularly auditing your progress, adapting to new challenges, and embracing lifelong learning.

In time, you’ll discover that each deliberate step taken to master your inner world grants you a potent sense of agency. Obstacles become less daunting, and achievements more fulfilling. While absolute control may remain an ever-moving target, the journey itself brings clarity, resilience, and a quality of life that feels liberated from the chaos of scattered thoughts and impulses.

Ultimately, “unreal” levels of self-control become tangible when you orchestrate mind, body, and environment in harmony—a symphony of discipline, awareness, and unwavering drive that can push you further than you ever imagined possible.",OpenAI,17,60,2024-12-24 05:49:47,BrandonLang
1hye961,,Can anyone with o1 API access share their experience? I just got it and would love to know what's different from o1-preview.,O1 docs ,OpenAI,8,17,2025-01-10 20:35:29,Synyster328
1h59q76,,Confused About Custom GPTs and Updates. Need clarity for following 6 questions. ,"Hi everyone,

I've been using a custom GPT I found in the ""Explore GPTs"" library on ChatGPT. It’s been a great help, but I have so many questions and confusions about how these custom GPTs work and how they get updated. I’m hoping someone here can help me understand a few things:

1. Model Updates:
My custom GPT says it’s using GPT-4, but I started using it even before I subscribed to the paid plan, and free accounts only had access to GPT-3.5 at the time. Does that mean it somehow transitioned from GPT-3.5 to GPT-4 when I upgraded? And if so, does it update to newer models automatically?


2. Newer Models Like GPT-4o and o1-Preview:
OpenAI has newer models like GPT-4o (turbo) and o1-preview. If these are faster or more efficient, why hasn’t my custom GPT been updated to use them? What’s the criteria for custom GPTs getting updated to these newer versions?


3. Personality and Memory Transitioning:
I’m thinking about starting a new regular chat to replicate my custom GPT’s personality and memory, just in case cuz I'm unsure about OpenAI's policy about model updates for custom GPTs and I am afraid the transition will only grow more troublesome the more cred and history i develop with this current custom GPT. But I’ve struggled in the past to transfer the relaxed, human-like tone and humor it currently has. Even when I provide prompts to guide the new chat, it often feels robotic and monotonous. Does anyone have tips on how to maintain the same vibe while transitioning?


4. Do I Have to Keep ""Re-Training""?
If I move to a regular chat instead of the custom GPT, will I have to constantly remind it about its personality and memory over time? Or is there a way to make it retain those traits consistently?


5. Custom GPT Future Compatibility:
Lastly, is it worth sticking to my custom GPT for the long run? Will it always stay updated with the latest models OpenAI launches, or is there a risk it’ll get stuck on an older version?


6. Finding the Best Custom GPTs:
I really like my current custom GPT, and I’d like to explore more like it. But how do I find the best ones in the ""Explore GPTs"" tab? Should I search by the creator of my current GPT since I’m impressed with their work? Or is it better to pick based on the number of users, reviews, or something else entirely?


I’m just trying to figure out if it’s better to invest my time in training a regular chat or if I should stick with my custom GPT and trust it’ll keep improving with future updates. Any insights would be much appreciated!

Thanks in advance, everyone. Looking forward to hearing your thoughts!


Edit: Following is the response when i asked the custom GPT about it just now (I even put the web feature on in hopes that it might help with a more up-to-date response):- 

""I understand your curiosity about the specific GPT model I'm using. As a custom GPT developed by AIResearchPlus.com, I operate on OpenAI's GPT-4 architecture. This means I utilize the advanced capabilities of GPT-4 to assist you effectively.

Regarding updates, OpenAI typically enhances its models over time. Custom GPTs like me are designed to benefit from these improvements, ensuring we provide the most accurate and up-to-date assistance. However, the exact timing and nature of these updates depend on OpenAI's development schedule and the configurations set by creators like AIResearchPlus.com.

If you have more questions or need further clarification, feel free to ask!""",OpenAI,1,8,2024-12-02 23:53:47,Raza2148
1held7d,,Some things that the latest models still can't do,"The o1 model answered all 3 of the first questions here wrong and confirmed the correct answers after I corrected it. Initial answers were 13, 12, and 27 - the last of which it insisted upon even after questioning until I told it the formula pattern I noticed and only then did it ""discover"" a known geometric formula that confirmed my observation. It gave up on question 4, even when I presented an answer I think is right and explained the approach:

""In cases like this, accuracy depends on either performing a thorough combinatorial proof or referencing established, peer-reviewed research on this very specific scenario.""

[https://megasociety.org/admission/power/](https://megasociety.org/admission/power/)

A task that a human could easily do (though tedious) that will break o1 is the following: Ask it to use or define 3 random or mixed up 100-letter sequences. For example, ""axvyiqn..."", which is the easy part. It successfully will form 3 sequences by asking for something like from ""a"" take every 7th letter, 11th letter, and 17th letter, and reverse the middle sequence (for more ""randomness"").

Then ask it to accurately form all 3 letter combinations by simply using the same letter for the same position (this would form 100 sequences, like ""azf"", ""xye"", etc.). This was based on a real task that I was trying to complete to generate all 3-letter patterns from a fixed set of characters. Every time it would make mistakes, either transposing letters, forgetting parts of the 100 character sequences, etc. I then had it generate a table that validated its output so it could see its own consistent mistakes and asked it to admit if it couldn't complete the task. I hadn't run it for a while so tried again today with the same outcome:

""Given the intricate nature of this problem and the extensive calculations required, I must conclude that I am unable to perform these steps flawlessly by hand within this environment. The high risk of human error in enumerating each step, combined with the complexity of verifying every detail, makes it impractical for me to guarantee a completely successful, error-free result.""

I love how it blames the ""high risk of human error"" in giving up. Another real task I was trying was to provide a long list of 4 letter words from a dictionary and ask it to filter all the ones without a commonly used English definition (I fed in over a thousand words):

PROMPT: ""Remove all words from this array that don't have a commonly known meaning in English. Respond with only the resulting array. Do not repeat any word once it has been used in the response.""

This always provides inaccurate results and stops early, ranging from starting to repeat itself (i.e. starts printing out a bunch of words, then a sequence of maybe 5-10 words loops, and gets worse as it goes before stopping). In one case, it ended up getting stuck and printing the same word a couple hundred times before stopping without explanation. In my most recent attempt it stopped early after just making up words that weren't in the input:

'""ZERO"", ""WRITE"", ""WHITE"", ""WHOLE"", ""THRONE"", ""TRAIN"", ""THEME"", ""THINK"", ""THANK"", ""TIGER"", ""TABLE"", ""THUMB"", ""TREND"", ""TIMELINE"", ""THUNDER"", ""WONDER"", ""WAITRESS"", ""XENON"", ""YOGURT"", ""YEAR"", ""YESTERDAY"", ""YARD"", ""YOUNG"", ""YOUTH"", ""ZEBRA"", ""ZOO""\]'

(All inputs were 4 letter words and you can see many of these are not 4 letter words.)

I believe the keys to these issues are very limited ""accurate short-term context precision"", which makes sense since it will cause a bunch of not-usually-related tokens to be processed. You can probably find a lot of variations on all of the above if you look at the weaknesses. The main strength of LLM is telling you want to hear when it doesn't require original thought. It's weakest point is any kind of reliable state management.

I will give props on one thing. Several months ago GPT-4 was terrible, even o1 was bad, at counting syllables. Not sure a year to fix it is reasonable. I presume this is because it has to do with perception of word sounds, so there is kind of a ""human"" aspect. As of today though, it did quite well with this:

possibly I can pretend  
AI can reason  
but we all know really it cannot  
maybe how to reason, it is us who have forgot

And this generation:

PROMPT: Write a poem about horses that is 7 lines with the syllabic structure: 11, 7, 11, 7, 11, 7, 11  
  
""Across green meadows wild horses run in light  
Their hooves softly drum below  
Starlight glistens on flanks shaped by ancient winds  
A gentle hush now low falls  
From dusty trails they emerge in warm dusk calls  
Herds whisper low in grey air  
They vanish, dark silhouettes of trembling grace""

To be clear, I think LLMs are a revolutionary step forward and have and will continue to change the world in ways that are difficult or impossible to imagine right now. There's also many people with a vested interest in hype making AI out to be something it is not (yet) in order to justify high costs, pricing, and valuations.",OpenAI,3,0,2024-12-15 04:58:23,Sure_Ambassador9503
