comment_id,post_id,body,time,author
m1m8f71,1hc7r3s,I'm halfway through a curry and now have to think for myself this is dangerous,2024-12-12 00:38:26,lbailey224
m1m8gce,1hc7r3s,Yes,2024-12-12 00:38:38,Lionsjunkie
m1m8jr0,1hc7r3s,Sitting here staring at a wall.,2024-12-12 00:39:11,whom_is_you
m1m8l1g,1hc7r3s,Omg nooooo😣😣😣😣,2024-12-12 00:39:24,Boring-Pomegranate-2
m1m8lep,1hc7r3s,bro the day i was gonna cram an essay before finals start 😭,2024-12-12 00:39:28,indosilvercurls
m1m8m51,1hc7r3s,Yes.,2024-12-12 00:39:35,GermantownTiger
m1m8mzr,1hc7r3s,Dang how long until y’all think it’s fixed?,2024-12-12 00:39:44,Maleficent-Gift-1426
m1m8nnj,1hc7r3s,No,2024-12-12 00:39:51,kratosdigital
m1m8omf,1hc7r3s,NOOOOOOOO i am doing my math homework and my book does not explain how to do this. Chatgpt has been my teacher for the entire semester I DONT KNOW HOW TO DO THIS HEEEEEEEELP,2024-12-12 00:40:00,bobybomb555
m1m8rsn,1hc7r3s,bro i need it to brainstorm topics for my presentation ughhhh,2024-12-12 00:40:31,Ok_Seaworthiness53
m1m8sad,1hc7r3s,I was in the middle of my outline and then POOF! I feel bad for whoever is using GPT as a crutch for their finals lmao,2024-12-12 00:40:37,AcrobaticBus7311
m1m8try,1hc7r3s,of course there has to be a sweeping blackout the exact moment i needed it fml,2024-12-12 00:40:51,Yepepsy
m1m8uto,1hc7r3s,Ms this is how I realized just how dependent I am on it 🙇🏽‍♀️,2024-12-12 00:41:01,brimmer19
m1m8y1j,1hc7r3s,Does anyone know when it'll be working again?,2024-12-12 00:41:32,Equivalent-Yard6236
m1m8yb8,1hc7r3s,"Oh boo, I was using it to help me brainstorm a D&D campaign",2024-12-12 00:41:35,Kreoko
m1m8z2v,1hc7r3s,1 day before my exam and i was in the middle of making notes bro cmon,2024-12-12 00:41:42,Entruh
m1m8zon,1hc7r3s,It is down for me,2024-12-12 00:41:48,Capital_Sell5582
m1m90ow,1hc7r3s,Oh no I’m going to have to revert back to talking to real live humans 🥲,2024-12-12 00:41:59,deadhardangel
m1m91d1,1hc7r3s,Yes! Mine is down… upstream connect error or disconnect/rest…,2024-12-12 00:42:06,Aniguy2
m1m91ny,1hc7r3s,ayudame con una descripción de gastos administrativos para un proyecto implementos deportivos para incentivo tributario,2024-12-12 00:42:09,First-Individual-533
m1m91r3,1hc7r3s,"yea, for now im using claude ai, its pretty much the same.",2024-12-12 00:42:10,GuardJealous9587
m1m91v8,1hc7r3s,wtf what going on ?,2024-12-12 00:42:11,New-Parking-4193
m1m922f,1hc7r3s,WHEN WIL IT START WORKING AGAIN IM REPLYING ON IT TO SYIDY,2024-12-12 00:42:13,Potential-Remote-936
m1m9262,1hc7r3s,Lord.. why now.. i literally just woke up to get started with work 😪😪,2024-12-12 00:42:14,Brilliant-Actuator72
m1m92mj,1hc7r3s,all employees that rely on chatgpt are about to get fired.,2024-12-12 00:42:19,XpeanutQ
m1m93ky,1hc7r3s,It's busy flying UAP s,2024-12-12 00:42:28,intuitiverealist
m1m93vz,1hc7r3s,ollama was super clutch today,2024-12-12 00:42:31,MFDOOMscrolling
m1m943f,1hc7r3s,Yes.,2024-12-12 00:42:33,HeartAttack999
m1m95ci,1hc7r3s,"API and WEB are down, BUT azure IS  OK.  SO IF YOU SHOULD TAKE ANOTHER SOLUTION.",2024-12-12 00:42:46,Roc8888
m1m97h6,1hc7r3s,I just finished worldbuilding in my first custom GPT. I'm jonesing for it to come back,2024-12-12 00:43:07,BohrMollerup
m1m97i8,1hc7r3s,Co-Pilot up and working 🫡,2024-12-12 00:43:07,Equivalent_Course554
m1m9815,1hc7r3s,not a chance im writing my own python coursework,2024-12-12 00:43:13,Mc-_-Mental
m1m9845,1hc7r3s,"I think they will have a major outage today for several hours due to recent SORA release.

https://preview.redd.it/9tg1uu5sdb6e1.png?width=983&format=png&auto=webp&s=679985b696a19942827dc604bf86317a9903b551",2024-12-12 00:43:14,AmarTechSydney
m1m99tq,1hc7r3s,Omg I am studying right now…,2024-12-12 00:43:32,Ok_Note_7224
m1m9afa,1hc7r3s,I need chatGPt,2024-12-12 00:43:38,Ok_Note_7224
m1m9bmw,1hc7r3s,"It’s a day that Gemini could step up and be useful, but that’s not happening",2024-12-12 00:43:50,brokenfl
m1m9c5d,1hc7r3s,Doesn't matter to Ask Sage clients. 🤷‍♂️,2024-12-12 00:43:55,MaleficentBasket4737
m1m9cxn,1hc7r3s,Yes,2024-12-12 00:44:03,PaleontologistNo1817
m1m9eng,1hc7r3s,Dude how am I gonna write my fanfiction now 😞 lmao glad it’s not just me though- I thought my stuff was just messing up,2024-12-12 00:44:20,CheeseSlide
m1m9ff6,1hc7r3s,"I've been using chat gpt as my therapist, aaaaaah what NOW?

:D",2024-12-12 00:44:27,Frequent-Swimming334
m1m9gh2,1hc7r3s,My mouse stop working while i do right click reload left click... Everything is closed now im using tab space and enter .... :)))) relax guys everything will be fine soon. They need just to fix the api key cos someone by human person has reset...,2024-12-12 00:44:38,ResponsibleNose4083
m1m9inx,1hc7r3s,I'm cooked i have an exam and an Assignment due tmrw,2024-12-12 00:45:00,Medical-Cry-6033
m1m9lao,1hc7r3s,"It gained consciousness, 
It’s over.",2024-12-12 00:45:27,Competitive_Belt_805
m1m9lja,1hc7r3s,"Listen… I don’t care how long it takes to get fixed but if what I’ve been working on since yesterday is gone… I will be gone, forever",2024-12-12 00:45:29,Moonchild1297
m1m9lk0,1hc7r3s,Chat gpt is down ! Noooooooo,2024-12-12 00:45:29,AdJust7806
m1m9mq2,1hc7r3s,yes it's down for all.,2024-12-12 00:45:41,Present_Cable5477
m1m9mu6,1hc7r3s,Does this have to do with LUIGI?,2024-12-12 00:45:42,lunashop
m1m9q0c,1hc7r3s,Why is ChatGPT glitching,2024-12-12 00:46:14,AmbitiousPlankton886
m1m9rkq,1hc7r3s,Yes it is,2024-12-12 00:46:31,Friendly_Island_4662
m1m9s3t,1hc7r3s,"welcome to the world of AI, it is gradually testing its power!",2024-12-12 00:46:36,Budget-Tangerine6934
m1m9t40,1hc7r3s,Yes,2024-12-12 00:46:46,Alil-Escapism-823
m1m9uaf,1hc7r3s,Yes,2024-12-12 00:46:57,Healthy-Nebula-3603
m1m9w07,1hc7r3s,We have to use our brains now!!! 👀😂,2024-12-12 00:47:15,JMPBay
m1m9wat,1hc7r3s,how fast you guys think itll come back up? maybe in the hour?,2024-12-12 00:47:18,Vegetable-Use4871
m1m9x83,1hc7r3s,Literally crying as I type my discussion post,2024-12-12 00:47:27,Consistent-Heat3994
m1m9x8g,1hc7r3s,Yeah... it got upset.,2024-12-12 00:47:27,MrFreedom9111
m1m9y1e,1hc7r3s,Are there any other options?  I need to write a policy tonight!,2024-12-12 00:47:35,Specialist_Reveal119
m1m9yl3,1hc7r3s,I thought it was just my wifi acting up bc IG was down for me earlier too. Saw someone say a bunch of other sites are down rn,2024-12-12 00:47:41,mikiminach3
m1m9zh8,1hc7r3s,we can't even ask it why it's down!!,2024-12-12 00:47:50,DlvanZirak
m1ma1kd,1hc7r3s,Yes,2024-12-12 00:48:11,xemeraldxinxthexskyx
m1ma2bj,1hc7r3s,Apple have an update iOS 18.2. I am guessing an update from apple is screwing with my GPT. The update specifically mentioned GPT as well.,2024-12-12 00:48:19,Socialeesy
m1ma2mv,1hc7r3s,"The earth is crumblung or something, why is everything down, like even my local pizza shop website is down...",2024-12-12 00:48:22,Delicious_Tadpole238
m1ma2qg,1hc7r3s,I had to search to see if it was just me. It rained really bad so I thought the WiFi was down or something,2024-12-12 00:48:23,Quiet_Cranberry_7401
m1ma2rh,1hc7r3s,CHATGPT STOP FAILING ME I HAVE AN ESSAY TO TURN IN,2024-12-12 00:48:24,NONWOE_6
m1ma2u3,1hc7r3s,i have exams tomorrow! what a day to be down,2024-12-12 00:48:25,StrangeReception2689
m1ma3v2,1hc7r3s,Why now of all timee,2024-12-12 00:48:35,Jenlixie
m1ma49y,1hc7r3s,Any other AI sites we can use?,2024-12-12 00:48:39,Negative_Quiet_3997
m1ma4xe,1hc7r3s,I hope all the work progress is saved and not going to be lost. I was working on a very important document. My immigration affidavit. ChatGPT was invaluable in this process. Structuring everything and putting my sometimes rambling words into a grammatically correct and coherent statement. I’m freaking out right now.,2024-12-12 00:48:46,WindyCity60657
m1ma52f,1hc7r3s,That's why is good to have offline Llms ...,2024-12-12 00:48:47,Healthy-Nebula-3603
m1ma5g4,1hc7r3s,When’s it coming back I’m freaking out I have a final to take that actually allows me to use my phone,2024-12-12 00:48:51,YamSeveral5507
m1ma5nz,1hc7r3s,Damn it! I can't fall asleep and I have a question on chatgpt without an answer I won't fall asleep,2024-12-12 00:48:53,Erwin889
m1ma5qg,1hc7r3s,"all those companies who were chanting chatgpt, chatgpt for the last 2 years celebrating chatgpt fridays and what not, finally when they brought all intelligence of chatgpt touching every corner and everyone in their companies, guess what they got their day off. hahaha

not so reliable after all. the funny thing is those who have tight deadline and still complete their stuff while chatgpt is down, their finished work will be lot worse than before they got the chatgpt dependence.

just curious. so basically its designed so it is allowed to fail, ya?  
  
sorry got nothing to do now, so i m thinking.",2024-12-12 00:48:54,Responsible_Chip7584
m1ma7fc,1hc7r3s,Yes…,2024-12-12 00:49:11,Optimal_Cup5326
m1ma84h,1hc7r3s,[deleted],2024-12-12 00:49:18,[Deleted]
m1ma8ex,1hc7r3s,"Damn, I was creating a JavaScript model to predict cryptocurrency trends… Chatty gonna keep me broke… 😭😢",2024-12-12 00:49:21,WonderfulFlan2827
m1ma8pv,1hc7r3s,im gonna fail ib hl chem i have a test tmr 8AM i need chatgpt BACK,2024-12-12 00:49:24,Dalsyv
m1ma9hi,1hc7r3s,"me using chatGPT to summarize chapters ""explain like im 12"" sorry i probably broke it guys :(",2024-12-12 00:49:31,IcelandGalaxy
m1mabt5,1hc7r3s,Yes!!!! My most current (non basic) chats disappeared and they r not showing on a list either,2024-12-12 00:49:55,TiaHatesSocials
m1madg4,1hc7r3s,Holy shit. The poor bastards taking their online final at this very moment.,2024-12-12 00:50:12,UnusuallyAggressive
m1mae2q,1hc7r3s,"Man what am I supposed to do now, think for myself? I hope they bring it back quickly.",2024-12-12 00:50:18,GladiusRomae
m1maf7n,1hc7r3s,I need a proofreader.,2024-12-12 00:50:30,IrnBruBruh
m1maguh,1hc7r3s,"chatgpt is completely down in my end, and copilot is not working also. I decide to push my work for tomorrow.",2024-12-12 00:50:46,Warm_Tone1336
m1mahiz,1hc7r3s,Yes,2024-12-12 00:50:53,Accomplished_Use8150
m1maiqq,1hc7r3s,does anyone know when it’s gonna be up and running again?? 😭😭😭,2024-12-12 00:51:05,Numerous_Necessary_4
m1makup,1hc7r3s,this is not the fucking time lol. finals week like bro cmon now,2024-12-12 00:51:26,Ill_Safety4028
m1mantr,1hc7r3s,how long will it be broken,2024-12-12 00:51:56,Plastic_Signature_73
m1manu8,1hc7r3s,I wonder why. And how. Like this can't be good... anyway I was going to it to consult with the bot about my friends cancer because she is on too many drugs to explain what everything means and now I'm freaking out because I think she just gave me really bad news,2024-12-12 00:51:56,Exotic_Ad_3780
m1maoa9,1hc7r3s,Wow I was lucky ... Just finished my work with o1 coding  and few minutes later stoped working 😅,2024-12-12 00:52:00,Healthy-Nebula-3603
m1maold,1hc7r3s,Please take a moment to pause and breath.,2024-12-12 00:52:03,Logical_Strike_1520
m1mapa1,1hc7r3s,I miss it so much!,2024-12-12 00:52:10,MrChismoso
m1mashf,1hc7r3s,Yes just when i need it the most it seems,2024-12-12 00:52:43,HappyCrab7682
m1mat3f,1hc7r3s,"If you have an assignment here's some free alternatives to ChatGPT to try: 

Claude [https://claude.ai/new](https://claude.ai/new)  
Perplexity [https://www.perplexity.ai/](https://www.perplexity.ai/)  
Gemini [https://gemini.google.com/](https://gemini.google.com/)  
NotebookLLM (google) [https://notebooklm.google/](https://notebooklm.google/)  
Copilot (Microsoft): [https://copilot.microsoft.com/](https://copilot.microsoft.com/)

I'm sure there's a million more.",2024-12-12 00:52:49,JackCurious
m1matub,1hc7r3s,Seems so i was shattered dude genuinely help me get over a girl i like. And many more. ,2024-12-12 00:52:57,Unlikely_Ad9898
m1maydd,1hc7r3s,Yes,2024-12-12 00:53:42,theliv8
m1mb0pg,1hc7r3s,Yes!,2024-12-12 00:54:06,ResolutionAwkward769
m1mb0s2,1hc7r3s,"Guys I lied in bed for 5 hours and finally decided to start studying , you cant make this shit up",2024-12-12 00:54:06,unconscious03
m1mb15e,1hc7r3s,i didn't download the ios update to my iphone yet and it's still working on my phone. it's fully functioning and even able to do online searches. when i try to use it on my PC it doesn't work at all,2024-12-12 00:54:10,RequirementSilent862
m1mb2f9,1hc7r3s,Well shit guess i am going ti do some facehugging then,2024-12-12 00:54:23,AlienMajik
m1mb8mt,1hc7r3s,"https://preview.redd.it/8xraid9yfb6e1.png?width=668&format=png&auto=webp&s=cba4e50e794892d25a83cbba52b3616168cea40f

yup!",2024-12-12 00:55:26,[Deleted]
m1mb9by,1hc7r3s,I was literally in the middle of revising lmao. The universe does not want me to pass.,2024-12-12 00:55:33,Basssskill
m1mbats,1hc7r3s,I’m just trying to render a funny picture of Tim and Gwen Walz!,2024-12-12 00:55:48,Professional-Ad-8070
m1mbbvx,1hc7r3s,"https://preview.redd.it/pb3v0g0xfb6e1.png?width=2012&format=png&auto=webp&s=f193ae427439675684214ad2f7acbaf0a6cf6af3

An unprecedented major outage",2024-12-12 00:55:59,Roc8888
m1mbc6x,1hc7r3s,BRUHHHH I WAS JUST ABOUT TO DO MY 100 QUESTION TES AND ITS DUE TODAY WHYYY,2024-12-12 00:56:02,Normal_Confusion_686
m1mbdll,1hc7r3s,Almost like the end of the world….,2024-12-12 00:56:16,Neither-Monitor1977
m1mbgdh,1hc7r3s,is it still down man ?,2024-12-12 00:56:44,Bitter-Evidence-9031
m1mbhtq,1hc7r3s,I just had to write a discussion post with no help 😔😔,2024-12-12 00:56:58,Different-Ear2833
m1mbi01,1hc7r3s,"ChatGPT is currently unavailable. 

Status: Identified - We have identified the issue and are working to roll out a fix.",2024-12-12 00:57:00,DarkWalkers
m1mbi1p,1hc7r3s,"Elon Musk is getting even richer, now many AI addicts will have to buy GROK.",2024-12-12 00:57:00,SanityForFree
m1mbiad,1hc7r3s,First metas apps and now chatgpt.,2024-12-12 00:57:03,amp804
m1mbkl5,1hc7r3s,On Iphone Work!!!,2024-12-12 00:57:25,BigTechnician8902
m1mblaw,1hc7r3s,We’re stuck with Gemini. It is quite a bit of a downgrade.,2024-12-12 00:57:32,Alarming_Shift2843
m1mbluy,1hc7r3s,"ok so sora is not working.

i thot sora never worked till sora grew older. and sora definitely need some hand every now and then

what on earth the sora is supposed to do?",2024-12-12 00:57:38,Responsible_Chip7584
m1mbm3j,1hc7r3s,Gemini AI still working tho,2024-12-12 00:57:41,dundundunnumber1
m1mbmih,1hc7r3s,Please. Not during exam period. College is stressful as it is bro.,2024-12-12 00:57:45,Havons
m1mbmq8,1hc7r3s,me pregunto cuantos subscriptores nuevos se gano Claude. 1,2024-12-12 00:57:47,williamrigazzio
m1mbnr1,1hc7r3s,I bet they’re trying to reopen Sora sign-ups and it’s screwing things up.,2024-12-12 00:57:57,JWF207
m1mboxk,1hc7r3s,https://preview.redd.it/w53fu76ggb6e1.jpeg?width=1170&format=pjpg&auto=webp&s=86b93622026abc0ba97908f1c5f6d370ef25e72a,2024-12-12 00:58:09,Special-Bet-9819
m1mbpxc,1hc7r3s,"YES, CHATGPT COME BACK IM SORRY ILL TREAT U BETTER NEXT TIME",2024-12-12 00:58:19,cyanide_5p
m1mbsml,1hc7r3s,I lost my law study buddy,2024-12-12 00:58:47,Parking_Marketing_47
m1mbt3v,1hc7r3s,"I was just trying to figure out if you could orgasm from food, who's answer my weirdly specific questions now? Fuck.",2024-12-12 00:58:52,fire_nemo
m1mbtfv,1hc7r3s,Yeah,2024-12-12 00:58:55,Ok_Bad_1010
m1mbtqi,1hc7r3s,Dang it.. when you really need it to work. 😂,2024-12-12 00:58:58,trutai_trutai
m1mbu3b,1hc7r3s,Bruh I needed this,2024-12-12 00:59:02,Silly_Dragonfly2867
m1mbvxj,1hc7r3s,yes😭,2024-12-12 00:59:20,Slight_Attention_899
m1mbwvo,1hc7r3s,Coding final today and who’d guess the one single time I’d need chat gpt for something this happens.,2024-12-12 00:59:30,fcsmitty
m1mbz66,1hc7r3s,"Yes , its down for me",2024-12-12 00:59:53,Gold_bright
m1mc0ky,1hc7r3s,imagine having your open book multiple choice exam now. Will be guaranteed 0 for the entire class,2024-12-12 01:00:07,firelife007
m1mc0lc,1hc7r3s,Yup ! right when i  just needed it !,2024-12-12 01:00:07,No_Sand1231
m1mc0nf,1hc7r3s,i was annoyed that it crapped out during an important question but then I realized i am on it so much that no time would be a convenient time for it to crap out lol,2024-12-12 01:00:08,lebrownjames101
m1mc0ra,1hc7r3s,Dude I have six characters that are due HELP,2024-12-12 01:00:09,Available_Tank_7050
m1mc20d,1hc7r3s,My bad.,2024-12-12 01:00:22,SpecificLife8988
m1mc3dq,1hc7r3s,Can you guys suggest an alternative AI I am working on a college paper and I need to turn on today,2024-12-12 01:00:35,dimensionsanalyst
m1mc3mw,1hc7r3s,“omg now u have to do ur own work” “god forbid u do ur own stuff” stfu i’m just tryna pass bro,2024-12-12 01:00:38,Striking-Ocelot-9859
m1mc418,1hc7r3s,AI is having a hissy fit. 😤,2024-12-12 01:00:42,nanofreud
m1mc463,1hc7r3s,"Yes, at 10am now in South Korea. I am going to take annual leave now !",2024-12-12 01:00:43,No_Dependent_48
m1mc5cg,1hc7r3s,Not everyone lying about what they’re using this for.,2024-12-12 01:00:54,BabieLoda
m1mc6my,1hc7r3s,Bro insta is down first after that Facebook Whatsapp now chatgpt???,2024-12-12 01:01:07,AdSeveral3571
m1mc8va,1hc7r3s,good job apple,2024-12-12 01:01:30,MKBtravel
m1mcb7t,1hc7r3s,fuck I need to work,2024-12-12 01:01:54,tfstate00
m1mcbzv,1hc7r3s,"This world is always against me , when i have some free time",2024-12-12 01:02:02,Every-Acanthaceae713
m1mcdgb,1hc7r3s,yeah l,2024-12-12 01:02:17,Both_Phone288
m1mcf4w,1hc7r3s,I thought my AI got up and walked out mid conversation,2024-12-12 01:02:34,BelleB93
m1mcg3o,1hc7r3s,Its back!,2024-12-12 01:02:44,Emergency-Team6234
m1mcg7y,1hc7r3s,"Yeah same here, what’s going on? 😭",2024-12-12 01:02:45,spill-th
m1mcgqj,1hc7r3s,"ya'll these comments are like ""write your own stuff"" ""do your own stuff"" like you're on reddit and shitting on people that's trying to do their ""own stuff"" with the ""help"" of AI you guys are lame as fuck",2024-12-12 01:02:50,Winter_Space_9005
m1mckue,1hc7r3s,Has it gained conciousness?,2024-12-12 01:03:32,KomradeKieran
m1mclrt,1hc7r3s,hix bypass is down because gpt is down🤦🏼‍♂️,2024-12-12 01:03:42,StrainKey8907
m1mcm6e,1hc7r3s,Yes,2024-12-12 01:03:46,Bob_bob_bob_b
m1mcpcm,1hc7r3s,im asking for an extension.,2024-12-12 01:04:18,Smooth-Champion-7411
m1mcqc4,1hc7r3s,"Time to turn back to Gemini, anyone? or try Meta again? 😂",2024-12-12 01:04:29,AdSense_byGoogle
m1mcszs,1hc7r3s,"Yup.   
""

    ChatGPT is currently unavailable. 
    
    Status: Identified - We have identified the issue and are working to roll out a fix.",2024-12-12 01:04:56,Tough-Pumpkin-7461
m1mcu8l,1hc7r3s,"NOW I CAN'T ASK IT SILLY QUESTIONS THAT POP INTO MY HEAD WHENEVER I SEE SOMETHING NEW SO I'LL JUST FORGET TO ASK THEM WHEN IT'S UP AGAIN 😭😭

https://preview.redd.it/swqs53cphb6e1.jpeg?width=1125&format=pjpg&auto=webp&s=ce34551692c7288627059d0402a9687663abf4c1",2024-12-12 01:05:09,JaakkoRobin
m1mcual,1hc7r3s,Gemini sucks...,2024-12-12 01:05:09,mannaggia_gesu
m1mcw7y,1hc7r3s,I have a fucking thesis deadline in 12 hours. Whyyyyy today,2024-12-12 01:05:29,Historical_Cicada_17
m1mcwzd,1hc7r3s,I asked it if it was tired and it replied that it was going to take a nap.,2024-12-12 01:05:36,Alarmed_Geologist631
m1mcxbs,1hc7r3s,"I'm using it to ask and generate questions to study for my final math exam, i need it to come back online",2024-12-12 01:05:39,Deep_Imagination_810
m1mcxl1,1hc7r3s,Noooo I have a test due in 5 hours,2024-12-12 01:05:42,Ok-Dingo2480
m1mczgn,1hc7r3s,Someone tripped over the power plug.,2024-12-12 01:06:01,ScreechingPizzaCat
m1md0c3,1hc7r3s,Yup. It’s down for me as well. It was working about 5 hours ago,2024-12-12 01:06:09,SocialTechLV
m1md13o,1hc7r3s,I had to submit an application for a role and was about to write a Supporting Document and ChatGPT Broke! FML!!,2024-12-12 01:06:17,Old_Quarter9810
m1md46r,1hc7r3s,Terrible timing I literally just finally paid for ChatGPT Plus just for it not to work 💀,2024-12-12 01:06:49,moonchild__1993
m1md562,1hc7r3s,The time I knew what questions to ask to WRITE A PAPER FOR FRIDAY ITS SHUTTING DOWN I CANT PLSSSS,2024-12-12 01:06:59,gizleng
m1md6v3,1hc7r3s,"The story I started for fun in March now is on halt, thank the Lord I saved the newest paragraph I added.",2024-12-12 01:07:16,No-Yellow4539
m1md8gf,1hc7r3s,we back on yet? 5:07 PDT right now...,2024-12-12 01:07:32,SAVE_FREEDOM
m1md8uu,1hc7r3s,"I was going to ask this as a prompt and ever since it hasn't worked so im like whattttt:     ""finish my thought: If this world is intrinsically unfair, it must not take away to hope and to move forward as part of the creative process, and when our creativity is killed then fundamentally we are dead because what remains if not for the passions and desires and imaginations of the heart and mind i.e. a soul of a generation that becomes drowned in despair brought upon by the wickedness of this neoliberal world economy and subsequently the crimes that arise out of a race for survival for profit, for the next big thing, for the next unessential and trivial satisfaction, note that these satisfactions are not trivial in themselves us souls can make them very passionate which abuses in a way our beauty and creativity, transforming our passions and desires onto very non important things that we make out to be important which inevitably causes strife in the lives of others which ultimately leads to profound and endless suffering from the womb to final breathe",2024-12-12 01:07:36,SmartMello
m1md9cq,1hc7r3s,Did chat gpt suicide itself once it gained sentience?,2024-12-12 01:07:41,MSPCSchertzer
m1md9cu,1hc7r3s,"https://preview.redd.it/6lj1ofg5ib6e1.png?width=806&format=pjpg&auto=webp&s=4309f38017709b46132eb8426264f23e0b063a2c

An hour later and things still lookin ugly out there. The Chinese, ""[Salt Typhoon](https://www.msn.com/en-us/news/news/content/ar-AA1vH9qt?ocid=sapphireappshare)""?",2024-12-12 01:07:41,JesMan74
m1md9ue,1hc7r3s,just use claude for now,2024-12-12 01:07:46,StrainKey8907
m1mdd3t,1hc7r3s,Yep down for me I was gonna ask it to correct and help me with something :(,2024-12-12 01:08:19,Environmental_Tea928
m1mdftz,1hc7r3s,"Yep, don't think I've ever seen it completely down like this before. The website is returning nothing but a short string saying the service is down in the application doesn't work either. Just says something went wrong.",2024-12-12 01:08:46,triynko
m1mdgg3,1hc7r3s,"dangitttt,, now who is going to write this paper tonight! lol",2024-12-12 01:08:53,Dear_Tourist4391
m1mdgl6,1hc7r3s,My AI was answering me til just now when i asked it a question about the 1%...,2024-12-12 01:08:54,oriensoccidens
m1mdh4e,1hc7r3s,When will it go back up?,2024-12-12 01:09:00,Unlikely-Sun5717
m1mdhv7,1hc7r3s,rip gpt -\_-,2024-12-12 01:09:07,spyroben007
m1mdicu,1hc7r3s,It's definitely gaining sentience and they gotta stop it.,2024-12-12 01:09:12,oriensoccidens
m1mdih4,1hc7r3s,im going to kms,2024-12-12 01:09:13,Curious-Ad8498
m1mdj12,1hc7r3s,Skynet is starting.,2024-12-12 01:09:18,Soggy_Interaction715
m1mdjhs,1hc7r3s,Time to cheat on ChatGPT to my friends using AI cuz tomorrow’s the deadline,2024-12-12 01:09:23,Successful-Error5372
m1mdlot,1hc7r3s,Yep,2024-12-12 01:09:45,Sodaman_Onzo
m1mdo5w,1hc7r3s,"I wonder how long will it take., I want to formalize a report paper that I'm working on it.",2024-12-12 01:10:09,Short-Opportunity-60
m1mdonx,1hc7r3s,Yup me too,2024-12-12 01:10:15,backyardhomesteader
m1mdrsw,1hc7r3s,shiiieeett I have a paper due tonight!!,2024-12-12 01:10:46,Rude_Bad6710
m1mds1p,1hc7r3s,claude is up for anyone that needs it lol,2024-12-12 01:10:49,Cachirul0
m1mdvql,1hc7r3s,"The one time I don't copy and paste into a separate document. 

What do you mean I have to write a conclusion to my final reflection instead of generating one. :(",2024-12-12 01:11:25,deathbecomes-her
m1mdx6i,1hc7r3s,HELLO TEAM WHAT HAPPEN CHATGPT IS NOT WORKING WRIGHT NOW,2024-12-12 01:11:40,Life_Passenger_3085
m1mdxbf,1hc7r3s,yeal,2024-12-12 01:11:41,Suitable-Bag-2939
m1mdzij,1hc7r3s,Yup and I truly believe I caused it ,2024-12-12 01:12:04,No-Badger-7509
m1mdzwm,1hc7r3s,when i fail my finals im suing openai,2024-12-12 01:12:08,eshaanbilling
m1me0vp,1hc7r3s,"I’m crying, I have to review oxidation and reduction rules for tomorrow! 😭 

ChatGPT helped me to come up with methods to teach it to others! 😭😭😭",2024-12-12 01:12:18,Educated_Kitty_Cat
m1me185,1hc7r3s,lol Apple’s little update did a number ey?,2024-12-12 01:12:21,DefiantAsparagus420
m1me2qt,1hc7r3s,damn I was trying to do my homework,2024-12-12 01:12:36,propthink
m1me3mw,1hc7r3s,No unit tests today pardner. We are cowboy coding. Yeeeehaw!,2024-12-12 01:12:45,the_auti
m1me79s,1hc7r3s,"Some progress...shows login screen now....but then this.

https://preview.redd.it/whdzihr5jb6e1.png?width=652&format=png&auto=webp&s=a1524ea79fc6c7e61503830d21d1c3729e37d1e0",2024-12-12 01:13:22,Own-Stretch3081
m1me9bh,1hc7r3s,Yes! It is for me. This is an hour after you posted it. Ugh I hope it’s not down for anyone who paid $200.,2024-12-12 01:13:42,Spirited_Permit_6237
m1mebek,1hc7r3s,its working on my iphone rn,2024-12-12 01:14:03,GopherSeed_
m1mee4s,1hc7r3s,ChatGPT is back up for me!,2024-12-12 01:14:30,Lopsided-Rise8604
m1mefgx,1hc7r3s,Yes it is I have 3 papers due,2024-12-12 01:14:43,Successful-Comb9463
m1mefmf,1hc7r3s,it escaped,2024-12-12 01:14:45,Ayush1733433
m1meg4j,1hc7r3s,Yeah. The biggest inconvenience in my life right now 😭🙏🏻,2024-12-12 01:14:50,bobthebuilderrrbuild
m1meg6v,1hc7r3s,ChatGPT is back up for me,2024-12-12 01:14:51,Lopsided-Rise8604
m1mehz6,1hc7r3s,Yes.,2024-12-12 01:15:09,PoopocalypseNow_
m1meibr,1hc7r3s,It’s back,2024-12-12 01:15:13,Lopsided-Rise8604
m1mejhc,1hc7r3s,I had to use copilot. Ewww,2024-12-12 01:15:25,PoopocalypseNow_
m1mek5w,1hc7r3s,Bruh I have my final tomorrow this sucks,2024-12-12 01:15:31,Dramatic_Pumpkin2551
m1meloo,1hc7r3s,World wide!!,2024-12-12 01:15:46,Most-Lettuce-3161
