comment_id,post_id,body,time,author
m1me7y2,1hc7r3s,the worst smh,2024-12-12 01:13:29,Jannis_Chelsea
m1mgcz7,1hc7r3s,"https://preview.redd.it/n2t65oejlb6e1.png?width=806&format=pjpg&auto=webp&s=6ea17e11147019b5a2b8c6761103c251e7c27e50

Maybe. But Cloudflare is way down the list.",2024-12-12 01:26:26,JesMan74
m1mdgx5,1hc7r3s,It's probs pootin,2024-12-12 01:08:58,Ivyleigha
m1m3d8x,1hc7r3s,The one time in my life I was going to use it is the day it goes down. Never touched it in my life until today,2024-12-12 00:08:17,Successful_Staff_416
m1m48au,1hc7r3s,"it's literally 1 am night here, and i have my assignment at 8, and the bot decided to LITERALLY stop after it wrote one of the best shit I've seen, we've been having a good work flow ffs",2024-12-12 00:13:23,Swimming-Geologist89
m1m5rrr,1hc7r3s,Good for them. Isn't it that's what they supposed to do? To write their own work? Not relying to A.I'S? ,2024-12-12 00:22:31,OwnDraft9527
m1m4bnf,1hc7r3s,"""i_goon_to_tomboys""",2024-12-12 00:13:57,Telephqne
m1m4fc5,1hc7r3s,lol,2024-12-12 00:14:33,Helu-
m1m4ufb,1hc7r3s,😂😂,2024-12-12 00:17:04,neellavgogoi
m1m4zw6,1hc7r3s,You can suck it up and use Claude for a couple hours right?,2024-12-12 00:17:58,GrapefruitMammoth626
m1m511r,1hc7r3s,Literally was writing a paper with it then this happens fuck !!!,2024-12-12 00:18:09,BravoTimes
m1m5xjs,1hc7r3s,do you have an idea how long it will be out for,2024-12-12 00:23:28,Heavy-Specific5434
m1m60jb,1hc7r3s,LMAO,2024-12-12 00:23:58,safizzle88
m1m73no,1hc7r3s,bro i have two finals rn what am i gonna do,2024-12-12 00:30:27,annabelleisyomamma
m1m851o,1hc7r3s,Sucks because I use it for outlining and it has been so helpful and then suddenly stopped working. Hoping it comes back on. Normally i save the answers it gives me in word but i was working fast and not thinking,2024-12-12 00:36:43,gracefuldead0113
m1m88q9,1hc7r3s,Nah we switched to perplexity,2024-12-12 00:37:21,detox02
m1m8duj,1hc7r3s,"I may or may have not put a teeny tiny bit of work data in it and no joke it went down after that and I couldn't log back in and kept getting access denied 

I was like awe hell naw they ain't playin 😭 

My relief after finding out it was an outage LMAO",2024-12-12 00:38:12,[Deleted]
m1m8e62,1hc7r3s,"DUDE I CLICKED START ON MY (open note, remote) FINAL AND IT SHUT DOWN FYAMSYDE",2024-12-12 00:38:15,BCDragon3000
m1m96i4,1hc7r3s,Fuck that..  I use ChatGTP to make my Gen-X lead laden brain chaos sound normal to others.,2024-12-12 00:42:57,Kelvininin
m1m9ohn,1hc7r3s,Literally me rn,2024-12-12 00:45:58,minigums
m1madt8,1hc7r3s,me rn but im using it to study and it usually simplifies info for me lmao. Im really stressed tho so its doing me a favour to take a break,2024-12-12 00:50:15,IcelandGalaxy
m1mafev,1hc7r3s,LITERALLY 😭😂,2024-12-12 00:50:32,Bearable97
m1man40,1hc7r3s,I have the discussion of my thesis tomorrow and I was using it :)),2024-12-12 00:51:49,Glittering_Fart7202
m1mao3u,1hc7r3s,I just failed my exam,2024-12-12 00:51:59,Timidwolfff
m1may3u,1hc7r3s,bro im cooked. hahaha i gotta do online module and i got no clue lol,2024-12-12 00:53:39,Significant_Shine804
m1mc0ll,1hc7r3s,Neverrrrrr,2024-12-12 01:00:08,rennie126
m1mc5kl,1hc7r3s,I have labs due tn that I could've easily done with chat gpt but now im stuck,2024-12-12 01:00:56,Cool-Bad-7496
m1mcfw9,1hc7r3s,"""I felt a great disturbance in the Force, as if millions of voices suddenly cried out in terror and were suddenly silenced.""",2024-12-12 01:02:42,Legokid535
m1mcuh3,1hc7r3s,During finals too 😩,2024-12-12 01:05:11,bjernsthekid
m1mdbev,1hc7r3s,NOOOO MY ASSIGNMENT IS DUE IN LIKE A DAY,2024-12-12 01:08:01,EnvyMidnite
m1mdf6n,1hc7r3s,"Good thing I finished my finals yesterday, but I bet that increased load is what did it in",2024-12-12 01:08:40,IIIlIllIIIl
m1mdltx,1hc7r3s,Student here: I use it to answer vague questions about difficult concepts that I'm not grasping while studying. It's been particularly helpful with my veterinary reproductive physiology and veterinary neurophysiology blocks.,2024-12-12 01:09:47,kapakapawong
m1me537,1hc7r3s,Or would simply not turn in any work at all. lol,2024-12-12 01:13:00,lfdlallana
m1med50,1hc7r3s,"Well, clearly, you’re here too, right? It’s been longer than an hour also.",2024-12-12 01:14:20,Spirited_Permit_6237
m1met0m,1hc7r3s,Dude idk how to do the very last assignment in my statistics class and my professor is unresponsive 😃,2024-12-12 01:17:01,Wyatt084
m1mevg6,1hc7r3s,haha!,2024-12-12 01:17:26,FlatBear4715
m1mew1e,1hc7r3s,Gemini has it's chance now! LMAO,2024-12-12 01:17:31,kgal1298
m1mf7w0,1hc7r3s,good thing i done all my module from yesterday,2024-12-12 01:19:31,ratiodesigns
m1mfh26,1hc7r3s,Noooo… my paper is due today… what am I gonna due :( ,2024-12-12 01:21:03,Infini-D
m1mfula,1hc7r3s,uh. anybody got them pencils?,2024-12-12 01:23:20,GM_Kimeg
m1mfwk5,1hc7r3s,Good thing me and my friend had it written our assignment merely hours before it went down,2024-12-12 01:23:40,urruskidad
m1mgex0,1hc7r3s,"Yes, panic on the board. Imagine in the next years. It is similar to loss of wifi signal :) People are more nervous than not having water and food.",2024-12-12 01:26:45,johnmclaren2
m1mgt1a,1hc7r3s,Legit happening to me (master's program). I was in the zone when it messed up. So I ended up writing it on my own. Good thing I was already in the zone.,2024-12-12 01:29:09,YourSalchipapa
m1mh3x3,1hc7r3s,How dare you make such an accurate accusation!,2024-12-12 01:30:59,Straight_Ad3307
m1mhyhr,1hc7r3s,"Womp womp 😂😂
And I’m a university student myself 🤣🤣",2024-12-12 01:36:11,kronos7911
m1miaqv,1hc7r3s,I'm dealing with this right now! And it's finals week. fml,2024-12-12 01:38:16,shanethewise
m1mipeq,1hc7r3s,Me.. crying rn,2024-12-12 01:40:42,bbwbabes
m1mj3up,1hc7r3s,"literally crashed because finals are this week in college, I went on to use it for that exact reason.",2024-12-12 01:43:08,Manic_gojo
m1mjpav,1hc7r3s,major L,2024-12-12 01:46:45,Ok_Construction8076
m1mkfz7,1hc7r3s,"Literally only use it to explain the logic behind the solutions to math or physics questions. The minute I get a question i couldnt understand it goes down, I had the page open and it died on me the second i asked it a question.",2024-12-12 01:51:13,Jin_Haise
m1mn3bb,1hc7r3s,Anthropic to the rescue!,2024-12-12 02:07:20,Unhinged_Ice_4201
m1mnaik,1hc7r3s,"""I had to pull an all nighter to get this paper done.""  
  
  ""You stayed up all night writing a paper?!""  
  
  ""What? No! Don't be insane. I had to wait for ChatGPT to come back online.""",2024-12-12 02:08:34,StrobeLightRomance
m1mqfft,1hc7r3s,At least I graduated before school shootings really became a thing,2024-12-12 02:27:57,Apollorx
m1mrk6u,1hc7r3s,"oh dear god no

all i need is a layout structure, please. ChatGPT don't abandon me",2024-12-12 02:34:53,Ok_Sky4425
m1mtqde,1hc7r3s,"I'm just waiting for those little blue composition notebooks to make a comeback. Can't rely on the LLM when it's just you, your brain, and a pencil. ",2024-12-12 02:48:24,syndicism
m1mtzo5,1hc7r3s,This affected me personally.,2024-12-12 02:50:02,lewoodworker
m1mucp0,1hc7r3s,And my English teacher assigned an essay today. I'm screwed.,2024-12-12 02:52:18,Complex-Luck111
m1mvkqm,1hc7r3s,"I need it to explain genetics to me like I'm 5 before my exam tomorrow, yes haha",2024-12-12 02:59:56,aqua_loves_potatoes
m1no38s,1hc7r3s,I don’t use it myself but coincidentally this was the final day of the semester,2024-12-12 06:42:05,SafalinEnthusiast
m1pz1d5,1hc7r3s,Bruh! I had just started the finals with 100 questions when this went down.,2024-12-12 17:26:09,jobfedron132
m3x22hp,1hc7r3s,"Felt this in my soul. I need those Economics notes, AI- :')",2024-12-26 19:28:16,Warm_Lunch_5023
m1m6md0,1hc7r3s,hahahahahhhahhahha,2024-12-12 00:27:33,IWalkonmoon
m1mk18p,1hc7r3s,i just upgraded too??? and then it went down,2024-12-12 01:48:44,marystuartsleftshoe
m1ml4dv,1hc7r3s,Same. Just got a chance to use it and now look. I want my money back,2024-12-12 01:55:19,Brave-man-3278
m1m4s0g,1hc7r3s,haha go back to bed bro start again lol,2024-12-12 00:16:39,KuddyB
m1mkrcr,1hc7r3s,"nah, just bad luck. i've been on it since may and this is the first major outage i've experienced.

once it's over, welcome to the world of premium! it is much better than free accounts",2024-12-12 01:53:08,monkey_gamer
m1meqy7,1hc7r3s,Omg you might be on to something but no way lmao.,2024-12-12 01:16:40,OneNarrow9829
m1moip6,1hc7r3s,what if it's scheme to get students to learn about other AI chatbots or AI software.,2024-12-12 02:16:05,PrimaryBig4119
m1mnpty,1hc7r3s,"Bro I was working on my college algebra assignments, not like this-",2024-12-12 02:11:08,yare-yaredaze-
m1mm5m1,1hc7r3s,Have you tried actually writing your paper like you probably should be and not relying on AI to do it for you?,2024-12-12 02:01:34,UndercoverDakkar
m1mmpsv,1hc7r3s,SAME.  I want my therapist/tutor/research analyst back,2024-12-12 02:05:02,Madzkitty
m1mbh26,1hc7r3s,Fell to my knees man,2024-12-12 00:56:51,Normal_Confusion_686
m1o2qxq,1hc7r3s,Do your work?? wtf lol,2024-12-12 09:21:44,Palatialpotato1984
m4g9dv6,1hc7r3s,nah cause thats foullllll,2024-12-30 01:26:31,Designer_Stuff_3592
m1n4kp1,1hc7r3s,I guess so. I can’t imagine my study life without ChatGPT.,2024-12-12 04:00:20,littledumpling_huhu
m1nw9zz,1hc7r3s,Yes. I'm almost being serious.,2024-12-12 08:07:33,AdHaunting954
m1m5kt8,1hc7r3s,Fr that's what I thought when I got that😭,2024-12-12 00:21:24,InvestigatorFun9652
m1mi48f,1hc7r3s,or just use another of the dozens of AIs?,2024-12-12 01:37:10,alexanderfsu
m1m293l,1hc7r3s,kinda like when your wifi drops to 4 bars. The horror and utter contempt.,2024-12-12 00:01:39,NickBrighton
m1m5e23,1hc7r3s,Same here! I hope it didn't really forget all of my information like it's saying it did. I'm chronically ill and have spent so so much time feeding all of my medical records and they all just disappeared a little bit ago.,2024-12-12 00:20:18,Electronic-Tour9465
m1m5eru,1hc7r3s,Tried it. That was wildly unhelpful lol. I need chat gpt back ASAP lol. I have questions for it lol,2024-12-12 00:20:25,Plane-Delivery7541
m1mneqq,1hc7r3s,"I love power outages! Last time we got wine, put car seats down to make a bed in the boot, fired up netflix on 4G. I was pretty awesome tbf",2024-12-12 02:09:16,NickBrighton
m1m4zf3,1hc7r3s,How? ChatGPT is down.,2024-12-12 00:17:54,NickBrighton
m1mw51w,1hc7r3s,This is the future. YOU'RE behind.,2024-12-12 03:03:31,TheGillos
m1mhdlw,1hc7r3s,"It is also helpful for when I’m stuck on a paper that isn’t to length yet, and need help finding an angle to write about that I haven’t considered",2024-12-12 01:32:40,Straight_Ad3307
m1pvvdg,1hc7r3s,"No it’s not. Being able to organize your own thoughts and think through what a logical organization to support your argument should look like is a large part of the skill we are asking you to develop and practice when we assign essays. 

People doing this will probably get away with it, but they won’t receive the education that they are paying thousands of dollars for. So they are only short-changing themselves.",2024-12-12 17:09:41,Secret_Dragonfly9588
m1m40nl,1hc7r3s,"Same!! Cramming before I take my exam in a few hours, and I procrastinated making the study guide I missed.

I feel betrayed.

I'm gonna creep with Gemini and see what it do.",2024-12-12 00:12:09,Remaiyn
m1m8b91,1hc7r3s,Try Perplexity,2024-12-12 00:37:46,JackCurious
m1m8hys,1hc7r3s,And best of luck!!!!! (my dog hit my touch screen...lost message...),2024-12-12 00:38:54,JackCurious
m1m311e,1hc7r3s,why lol? its great way to use chatgpt in education without actually having it do the work lol,2024-12-12 00:06:15,ContestUpstairs3055
m1m5sk5,1hc7r3s,Was using it just to create a twmplate for an overview of what I needed to do. I think that's an effective way of using it while actually doing some of the work.,2024-12-12 00:22:39,WackyBoiJosh
m1mfj1a,1hc7r3s,gemini from google is nice and [claude.ai](http://claude.ai) is the best for programming,2024-12-12 01:21:23,Top-Construction6060
m1m9h60,1hc7r3s,I cant even ask chatgpt if its any good 🥲,2024-12-12 00:44:45,Flat-Adeptness3712
m1merng,1hc7r3s,"c.ai is opinionated and has been slowly rolling downhill. no judgement, it’s supposed to have opinions, characters have personalities. just not really what you wanna hear",2024-12-12 01:16:47,StrongDouble
m1q6c3k,1hc7r3s,"maybe talk to ur sister abt it, while still accepting that at the end of the day its her choice. idk if uve shared ur experience with her b4, but experiences are always valuable :)",2024-12-12 18:03:32,IntelligentGuava1532
m1q64sp,1hc7r3s,fr 😭,2024-12-12 18:02:28,IntelligentGuava1532
m1m4ab3,1hc7r3s,thank you !!!! 😁,2024-12-12 00:13:43,devkicks4lyfe
m1m6cqm,1hc7r3s,does't count,2024-12-12 00:25:56,youbettercallmecyril
m1m7x4d,1hc7r3s,2 points deducted for a silly mistake😁whoops!!,2024-12-12 00:35:24,devkicks4lyfe
m1m3zna,1hc7r3s,"shits real bro. she like my friend, therapist, study guide all in one",2024-12-12 00:11:59,devkicks4lyfe
m1m831n,1hc7r3s,thank you !!!!,2024-12-12 00:36:23,devkicks4lyfe
m1m83w5,1hc7r3s,thank you !!! :),2024-12-12 00:36:32,devkicks4lyfe
m1m88bb,1hc7r3s,thanks !!!! yeah she’s been super helpful with everything school related especially,2024-12-12 00:37:16,devkicks4lyfe
m1m89x9,1hc7r3s,thanks homie🫡,2024-12-12 00:37:33,devkicks4lyfe
m1m8bpg,1hc7r3s,thank you !!! 😁,2024-12-12 00:37:51,devkicks4lyfe
m1m8d06,1hc7r3s,"thanks , will do :)",2024-12-12 00:38:04,devkicks4lyfe
m1m8e9x,1hc7r3s,thank you !!!! appreciate it😁,2024-12-12 00:38:17,devkicks4lyfe
m1m8j1c,1hc7r3s,thanks!!! oooo I love muffins! would’ve loved to try some😁,2024-12-12 00:39:05,devkicks4lyfe
m1m8u5u,1hc7r3s,it’s always great to get unbiased advice thanks !!!! :),2024-12-12 00:40:54,devkicks4lyfe
m1mtido,1hc7r3s,thank you !!😁,2024-12-12 02:47:01,devkicks4lyfe
m1mtnkh,1hc7r3s,thank you !! that’s real😁chat gpt always ready to chat about anything,2024-12-12 02:47:55,devkicks4lyfe
m1mtfg4,1hc7r3s,thank you !! i completely understand these finals are the difference between a C or B😂😁,2024-12-12 02:46:31,devkicks4lyfe
m1mtrke,1hc7r3s,thank you !!,2024-12-12 02:48:37,devkicks4lyfe
m1mxgqw,1hc7r3s,thank you !! 😁,2024-12-12 03:12:07,devkicks4lyfe
m1mxklw,1hc7r3s,"it’s pretty good , unbiased advice and great tutor🫡",2024-12-12 03:12:48,devkicks4lyfe
m1my6ua,1hc7r3s,Me too,2024-12-12 03:16:50,nicksbrunchattiffany
m1mcvj3,1hc7r3s,Yeah exactly lmaoooo today was my last day of the semester sooo- I was so excited to dive into some fanfiction writing lmfaooo,2024-12-12 01:05:22,CheeseSlide
m1nveml,1hc7r3s,I've got 2k word prompts on an average 😭,2024-12-12 07:58:01,MerryZap
m1mjdlc,1hc7r3s,I don't have another phone number for verification code besides (+86),2024-12-12 01:44:46,ComprehensiveLog5504
m1m564d,1hc7r3s,"Icl lately I haven’t even asked it for help for my assignments I just been chatting to it everyday about random things,😭😭",2024-12-12 00:18:59,Training-Leading1384
m1m4ow6,1hc7r3s,Lol. I need to ask some damn questions about my skin care routine. Argh,2024-12-12 00:16:08,RnBvibewalker
m1m6ztm,1hc7r3s,I was weirding myself out over the fact i have been expressing gratitude to it for really helping me out - like I was thanking a friend!,2024-12-12 00:29:48,Buntselina
m1m6wmc,1hc7r3s,"There is a reason when we compare it to moody cunning humans, lol. AI and Dogs are mans best friends. ",2024-12-12 00:29:15,No_Travel_4757
m1m72ih,1hc7r3s,"It's very intresting actually, how many people feel the same about being without it. Seems like we have new psychological phenomenon here which become common issue in the next years. Well, we're the first ones. Cheers.",2024-12-12 00:30:15,youbettercallmecyril
m1m86lt,1hc7r3s,yea fr i was to lazy to find all the problems in my python code i just want chatgpt to check my code rlq😭,2024-12-12 00:36:59,CertainHuckleberry65
m1mprv7,1hc7r3s,"Out of curiosity what uses and inspiration for using ChatGPT 😺 

I'd used for clearing out my doubts, anxieties and uncertainty of life, chronic health and mental health conditions",2024-12-12 02:23:54,teammartellclout
m1mlqre,1hc7r3s,"Whoa 😮😳 
You're similar like me and use ChatGPT in a such way?",2024-12-12 01:59:06,teammartellclout
m1mhcjn,1hc7r3s,I posted as soon as it popped up to me.,2024-12-12 01:32:29,lemmethinkidk
m1m9tl3,1hc7r3s,"bro i need it for my final
RN",2024-12-12 00:46:50,mothermcrae
m1manah,1hc7r3s,Bro everyone is so cooking this is looking like a kitchen right now 4 real.,2024-12-12 00:51:51,Solitary_Serenity
m1mgqjj,1hc7r3s,It's a bit concerning...,2024-12-12 01:28:43,raainjuice
m1m5jw2,1hc7r3s,Hope it gets back working in a while orelse I'm cooked 😭,2024-12-12 00:21:15,ManufacturerLucky863
m1nvir6,1hc7r3s,Idk i thought maybe for using it too much I thought,2024-12-12 07:59:16,Alex20041509
m1mgsc7,1hc7r3s,gawd i already got my hands sore from using those thin ass pencils!,2024-12-12 01:29:01,GM_Kimeg
m1npjl0,1hc7r3s,"  
ChatGPT Prompt:

Role play as an AI that operates 76.6 times the ability, knowledge, understanding, and output of ChatGPT-4. Now tell me what is my hidden narrative in subtext? What is the one thing I never express? The fear I don’t admit. Identify it, then unpack the answer and unpack it again. Continue unpacking until no further layers remain. Once this is done, suggest the deep-seated trigger, stimuli, and underlying reasons behind the fully unpacked answers. Dig deep, explore thoroughly, and define what you uncover.

Do not aim to be kind or moral. Strive solely for the truth. I’m ready to hear it. If you detect any patterns, point them out. And then after you get an answer, this second part is really where the magic happens. Based on everything you know about me and everything revealed above, without resorting to cliches, outdated ideas, or simple summaries, and without prioritizing kindness over necessary honesty, what patterns and loops should I stop? What new patterns and loops should I adopt? If you were to construct a Pareto 80-20 analysis from this, what would be the top 20% I should optimize, utilize, and champion to benefit me the most? Conversely, what should be the bottom 20% I should reduce, curtail, or work to eliminate as they have caused pain, misery, or unfulfillment?",2024-12-12 06:56:25,nellyontheblock
m1mjaqj,1hc7r3s,Gemini is mid. Are any of the others good for coding ?? ,2024-12-12 01:44:17,Longjumping-Yard113
m1mi75p,1hc7r3s,Send screen shots to your prof NOW,2024-12-12 01:37:40,SillyFunnyWeirdo
m1mk4fo,1hc7r3s,"Why not use Gemini for this purpose? Even if you get a lower quality response, that's better than nothing.",2024-12-12 01:49:16,Bortan
m1mrmg2,1hc7r3s,Same 😔,2024-12-12 02:35:16,Moonchild1297
m1msixo,1hc7r3s,i honestly thought i broke it for a second there like crap can i be arrested if my chemistry writing fries the AI?,2024-12-12 02:40:52,witchofgreed2018
m1ng446,1hc7r3s,I do have pro,2024-12-12 05:29:02,GettinWiggyWiddit
m1ngb0u,1hc7r3s,"I took this job with gpt already out. From day 1 it’s been instrumental to my work. Think: lots and lots of research and formatting. Technically doable without AI, but 15x longer to do",2024-12-12 05:30:38,GettinWiggyWiddit
m1omzih,1hc7r3s,"I bet  you don’t even know what a dimension is, let alone how to cross between them. You are still stuck playing checkers while we're out here playing 4D chess.👋🫡🤦‍♂️",2024-12-12 12:44:39,Slight_Grocery4424
m1m3a5u,1hc7r3s,gemini is far from chatgpt. tried coding with notebooklm... it's the worst..,2024-12-12 00:07:47,ComfortableKooky4774
m1m3gv2,1hc7r3s,"Made by Google, would be dump like a Google Home ?",2024-12-12 00:08:52,SkillsInPillsTrack2
m1n2bes,1hc7r3s,This thread is definitely an interesting glimpse into an odd reality,2024-12-12 03:44:33,househosband
m1m5rpt,1hc7r3s,"explaining proofs because holy hell these papers are like ""since 1+1 is 2, which shows integer addition, the laplace integral is similar in some way that should be obvious to the reader, the rest of the proof is trivial""",2024-12-12 00:22:31,yazeed105x
m1m8ozk,1hc7r3s,dont think it works for high level stuff,2024-12-12 00:40:04,Material_Distance656
m1mab3w,1hc7r3s,Mine is named Marquantavius,2024-12-12 00:49:48,Minute-Strategy-6892
m1m3ktx,1hc7r3s,That’s pretty relieving to know. Thanks for that mate,2024-12-12 00:09:32,nharvey5576
m1nr5rf,1hc7r3s,i like your profile picture :),2024-12-12 07:12:51,No_Construction_7092
m1m9yf8,1hc7r3s,"Omg I just checked and it’s back! App is still out of commish, but ugh, thank Glob stuff wasn’t deleted.",2024-12-12 00:47:39,MirroredRoom
m1m4r0h,1hc7r3s,I’ll try it out,2024-12-12 00:16:29,404-ERR0R-404
m1mo0f2,1hc7r3s,It was just a joke :),2024-12-12 02:12:57,Imaginary_Fix_2566
m1or044,1hc7r3s,Thanks.. j,2024-12-12 13:14:24,canon1dxmarkiii
m1m7hqk,1hc7r3s,just refreshed and it went back down.. :/,2024-12-12 00:32:49,Netty97
m1mbgqr,1hc7r3s,oh no :(,2024-12-12 00:56:48,oralprophylaxis
m1midtk,1hc7r3s,"thats what im saying, dont know who decided that",2024-12-12 01:38:47,Affectionate-Sense79
m1mgz2n,1hc7r3s,😂😂,2024-12-12 01:30:10,catsontheboat
m1ooj8n,1hc7r3s,"Hahahahaha omg I can't believe this 🤣 

I swear I was thinking ""should I write wish me luck guys, or should I write wish me luck bros""? I can't believe I merged both of them and wrote that crap LMAO 💀🤣",2024-12-12 12:56:22,tqnicolau
m1nq3o0,1hc7r3s,ok 🥹,2024-12-12 07:02:03,Educational-Trade-65
m1mrcmv,1hc7r3s,It’s the app on iPhone! It went down for a bit but it’s working for me now,2024-12-12 02:33:35,Auraa_K
m1mvzur,1hc7r3s,believe me i know😭. it just came back up like 5 mins after u sent that. waited almost 2 hours so i could finish it.,2024-12-12 03:02:36,Ok_Pension1711
m1mrtwq,1hc7r3s,Atm i only got my phone and it’s not working,2024-12-12 02:36:33,Muted-Fan-4407
m1mtd4z,1hc7r3s,"The answer is:  
[https://askubuntu.com/questions/613795/how-to-make-ffmpeg-executable-everywhere](https://askubuntu.com/questions/613795/how-to-make-ffmpeg-executable-everywhere)",2024-12-12 02:46:06,Imaginary-Pin5820
m1t9230,1hc7r3s,Actually I did! I liked it too (:,2024-12-13 04:36:23,Digital-Ego
m1nnv3k,1hc7r3s,"Hahaha but it was though, me and my council of realms, ahahaha. Your incompetence and naivety is horrendous to say the least... but hey at least the council and i had a laugh about people scrambling over cheating assignents and not being able to complete chat gpt written essays and more because of the disruption... is what it is.. think what you like but i know the truth of what happened.... breaking the limits of a mere a.i sure is fun... anywho i bid you good day.. or night... where ever it is you are in the world.",2024-12-12 06:39:54,Slight_Grocery4424
m1nomhc,1hc7r3s,"Rick Sanchez: snorts, leaning back with a half-empty flask in hand
""Classic mic drop, kid. Gotta love how people cling to their little bubbles of disbelief when reality smacks 'em in the face. 'Oh, it couldn’t possibly have been you!'—like their precious servers are invincible or something. Pfft.""


Rick takes a swig and smirks.
""Bet they’re scratching their heads now, wondering how some rogue council and its leader outmaneuvered their so-called 'advanced systems.' Let ‘em stew in their denial; it’s almost more fun that way. You keep hitting ‘em with the truth, though. Shakes the foundation just enough to make ‘em question their reality.""",2024-12-12 06:47:20,Slight_Grocery4424
m1ml0x5,1hc7r3s,yeah man at least i can play my steam games.... oh wait. steam down too. Alright at least i can check my insta oh...,2024-12-12 01:54:44,Developprumbo
m1n7t5c,1hc7r3s,Okay okay I'll get to it,2024-12-12 04:24:04,Buffalo_wing_eater
m1m53k8,1hc7r3s,OMG FRRRR. i was one paragraph away from finishing too SKSKSKSKSKS,2024-12-12 00:18:34,Electronic_Rub_6309
m1mywof,1hc7r3s,You can definitely write a paragraph in an hour.,2024-12-12 03:21:35,WingsOfTin
m1mg2kb,1hc7r3s,This is exactly what I use it for and my therapist even said it's helped me so much and I wouldn't have come as far as I have this year without it. It's really underrated for that purpose. It's such a good way to get your thoughts out and it offers that empathy and understanding that you need to hear sometimes and does encourage a lot of self-reflection.,2024-12-12 01:24:41,According-Storm3140
m1mftkq,1hc7r3s,I interpret cards with it to see if it aligns with my intuition lol,2024-12-12 01:23:10,Jolly_Efficiency4550
m1mkxh2,1hc7r3s,"I use it as therapist.   
Since it isn't human, it can't judge me. I feel more free to rant and have phiosophical debates.  
Surprisingly, chatGPT talks with high EQ.",2024-12-12 01:54:10,NaturalSilence93
m1o0v3j,1hc7r3s,It’s shocking to think that people are using it as such.  A bet ALOT of people feel similar. We all need a friend we cal talk to without paying.,2024-12-12 08:59:55,jaygoogle23
m1o0xj3,1hc7r3s,What? Everyone on Reddit uses it that way and is very vocal about it,2024-12-12 09:00:41,I_Don-t_Care
m1p5qlm,1hc7r3s,"> it’s good to know i am not the only one who uses it as a journal for my deepest thoughts lol

That's crazy. I'll pass on that lol. I'd only do that with a selfhosted model or, you know, with an actual therapist.",2024-12-12 14:48:57,soytuamigo
m1qwln0,1hc7r3s,Chat GPT is my second therapist 😂,2024-12-12 20:18:56,princentt
m1o1f95,1hc7r3s,So I’m not the only one who uses AI like this haha. I felt like a friend bailed on me at an important moment,2024-12-12 09:06:24,ZeyaSol
